{
  "name": "Trade Republic",
  "country": "DE",
  "status": "active",
  "delimiter": ";",
  "encoding": "utf-8",
  "date_format": "dd.MM.yyyy",
  "decimal_format": "de",
  "headers": ["Datum", "Betrag", "Beschreibung"],
  "column_map": {
    "date": "Datum",
    "amount": "Betrag",
    "purpose": "Beschreibung"
  },
  "sample_rows": [
    ["01.01.2026", "-50,00", "Dividende Apple Inc."]
  ]
}
