{
  "name": "Commerzbank",
  "country": "DE",
  "status": "active",
  "delimiter": ";",
  "encoding": "windows-1252",
  "date_format": "dd.MM.yyyy",
  "decimal_format": "de",
  "headers": ["Buchungstag", "Betrag", "Buchungstext"],
  "column_map": {
    "date": "Buchungstag",
    "amount": "Betrag",
    "purpose": "Buchungstext"
  },
  "sample_rows": [
    ["01.01.2026", "-25,00", "Kaufland Filiale 123"]
  ]
}
